{
  "family": "ARMCM3xxx",
  "architecture": "arm-cortex-m3",
  "vendor": "Unknown",
  "mcus": {
    "ARMCM3xxx": {
      "flash": {
        "size_kb": 64,
        "base_address": "0x08000000",
        "page_size_kb": 1
      },
      "ram": {
        "size_kb": 20,
        "base_address": "0x20000000"
      },
      "peripherals": {
        "TIM": {
          "instances": [
            {
              "name": "TIMER0",
              "base": "0x40010000",
              "irq": 0
            },
            {
              "name": "TIMER1",
              "base": "0x40010100",
              "irq": 4
            },
            {
              "name": "TIMER2",
              "base": "0x40010200",
              "irq": 6
            }
          ],
          "registers": {
            "CR": {
              "offset": "0x00",
              "size": 32,
              "description": "Control Register"
            },
            "SR": {
              "offset": "0x04",
              "size": 16,
              "description": "Status Register"
            },
            "INT": {
              "offset": "0x10",
              "size": 16,
              "description": "Interrupt Register"
            },
            "COUNT": {
              "offset": "0x20",
              "size": 32,
              "description": "The Counter Register reflects the actual Value of the Timer/Counter"
            },
            "MATCH": {
              "offset": "0x24",
              "size": 32,
              "description": "The Match Register stores the compare Value for the MATCH condition"
            },
            "PRESCALE_RD": {
              "offset": "0x28",
              "size": 32,
              "description": "The Prescale Register stores the Value for the prescaler. The cont event gets divided by this value"
            },
            "PRESCALE_WR": {
              "offset": "0x28",
              "size": 32,
              "description": "The Prescale Register stores the Value for the prescaler. The cont event gets divided by this value"
            },
            "RELOAD[%s]": {
              "offset": "0x50",
              "size": 32,
              "description": "The Reload Register stores the Value the COUNT Register gets reloaded on a when a condition was met."
            }
          }
        }
      },
      "interrupts": {
        "count": 23,
        "vectors": [
          {
            "number": 0,
            "name": "Initial_SP"
          },
          {
            "number": 1,
            "name": "Reset_Handler"
          },
          {
            "number": 2,
            "name": "NMI_Handler"
          },
          {
            "number": 3,
            "name": "HardFault_Handler"
          },
          {
            "number": 4,
            "name": "MemManage_Handler"
          },
          {
            "number": 5,
            "name": "BusFault_Handler"
          },
          {
            "number": 6,
            "name": "UsageFault_Handler"
          },
          {
            "number": 11,
            "name": "SVC_Handler"
          },
          {
            "number": 12,
            "name": "DebugMon_Handler"
          },
          {
            "number": 14,
            "name": "PendSV_Handler"
          },
          {
            "number": 15,
            "name": "SysTick_Handler"
          },
          {
            "number": 16,
            "name": "TIMER0_IRQHandler"
          },
          {
            "number": 20,
            "name": "TIMER1_IRQHandler"
          },
          {
            "number": 22,
            "name": "TIMER2_IRQHandler"
          }
        ]
      }
    }
  }
}