{
  "family": "Example",
  "architecture": "arm-cortex-m3",
  "vendor": "Example Vendor",
  "mcus": {
    "EXAMPLE_MCU": {
      "flash": {
        "size_kb": 128,
        "base_address": "0x08000000",
        "page_size_kb": 2
      },
      "ram": {
        "size_kb": 20,
        "base_address": "0x20000000"
      },
      "peripherals": {
        "GPIO": {
          "instances": [
            {"name": "GPIOA", "base": "0x40010800"},
            {"name": "GPIOB", "base": "0x40010C00"},
            {"name": "GPIOC", "base": "0x40011000"}
          ],
          "registers": {
            "CRL": {"offset": "0x00", "size": 32, "description": "Port configuration register low"},
            "CRH": {"offset": "0x04", "size": 32, "description": "Port configuration register high"},
            "IDR": {"offset": "0x08", "size": 32, "description": "Port input data register"},
            "ODR": {"offset": "0x0C", "size": 32, "description": "Port output data register"},
            "BSRR": {"offset": "0x10", "size": 32, "description": "Port bit set/reset register"},
            "BRR": {"offset": "0x14", "size": 32, "description": "Port bit reset register"},
            "LCKR": {"offset": "0x18", "size": 32, "description": "Port configuration lock register"}
          }
        },
        "USART": {
          "instances": [
            {"name": "USART1", "base": "0x40013800", "irq": 37},
            {"name": "USART2", "base": "0x40004400", "irq": 38}
          ],
          "registers": {
            "SR": {"offset": "0x00", "size": 32, "description": "Status register"},
            "DR": {"offset": "0x04", "size": 32, "description": "Data register"},
            "BRR": {"offset": "0x08", "size": 32, "description": "Baud rate register"},
            "CR1": {"offset": "0x0C", "size": 32, "description": "Control register 1"},
            "CR2": {"offset": "0x10", "size": 32, "description": "Control register 2"},
            "CR3": {"offset": "0x14", "size": 32, "description": "Control register 3"}
          }
        }
      },
      "interrupts": {
        "count": 68,
        "vectors": [
          {"number": 0, "name": "Initial_SP"},
          {"number": 1, "name": "Reset_Handler"},
          {"number": 2, "name": "NMI_Handler"},
          {"number": 3, "name": "HardFault_Handler"},
          {"number": 4, "name": "MemManage_Handler"},
          {"number": 5, "name": "BusFault_Handler"},
          {"number": 6, "name": "UsageFault_Handler"},
          {"number": 11, "name": "SVC_Handler"},
          {"number": 12, "name": "DebugMon_Handler"},
          {"number": 14, "name": "PendSV_Handler"},
          {"number": 15, "name": "SysTick_Handler"},
          {"number": 37, "name": "USART1_IRQHandler"},
          {"number": 38, "name": "USART2_IRQHandler"}
        ]
      },
      "clock": {
        "max_freq_mhz": 72,
        "hse_freq_mhz": 8,
        "hsi_freq_mhz": 8
      }
    }
  }
}
