{
  "family": "FU540",
  "architecture": "arm-cortex-m3",
  "vendor": "SiFive",
  "mcus": {
    "FU540": {
      "flash": {
        "size_kb": 64,
        "base_address": "0x08000000",
        "page_size_kb": 1
      },
      "ram": {
        "size_kb": 20,
        "base_address": "0x20000000"
      },
      "peripherals": {
        "MSEL": {
          "instances": [
            {
              "name": "MSEL",
              "base": "0x00001000"
            }
          ],
          "registers": {
            "MSEL": {
              "offset": "0x00",
              "size": 32,
              "description": "The MSEL pin state"
            }
          }
        },
        "PRCI": {
          "instances": [
            {
              "name": "PRCI",
              "base": "0x10000000"
            }
          ],
          "registers": {
            "hfxosccfg": {
              "offset": "0x00",
              "size": 32,
              "description": "Crystal Input Control Register"
            },
            "corepllcfg0": {
              "offset": "0x04",
              "size": 32,
              "description": "Core PLL Configuration Register"
            },
            "ddrpllcfg0": {
              "offset": "0x0C",
              "size": 32,
              "description": "DDR PLL Configuration Register"
            },
            "ddrpllcfg1": {
              "offset": "0x10",
              "size": 32,
              "description": "DDR PLL Configuration Register"
            },
            "gemgxlpllcfg0": {
              "offset": "0x1C",
              "size": 32,
              "description": "Gigabit Ethernet PLL Configuration Register"
            },
            "gemgxlpllcfg1": {
              "offset": "0x20",
              "size": 32,
              "description": "Gigabit Ethernet PLL Configuration Register"
            },
            "coreclksel": {
              "offset": "0x24",
              "size": 32,
              "description": "CORECLK Source Selection Register"
            },
            "devicesresetreg": {
              "offset": "0x28",
              "size": 32,
              "description": "Peripheral Devices Reset Control Register"
            },
            "clkmuxstatus": {
              "offset": "0x2C",
              "size": 32,
              "description": "CLKMUX Status Register"
            },
            "procmoncfg": {
              "offset": "0xF0",
              "size": 32,
              "description": "PROCMON Configuration Register"
            }
          }
        },
        "USART": {
          "instances": [
            {
              "name": "UART0",
              "base": "0x10010000"
            },
            {
              "name": "UART1",
              "base": "0x10011000"
            }
          ],
          "registers": {
            "txdata": {
              "offset": "0x00",
              "size": 32,
              "description": "Transmit Data Register"
            },
            "rxdata": {
              "offset": "0x04",
              "size": 32,
              "description": "Receive Data Register"
            },
            "txctrl": {
              "offset": "0x08",
              "size": 32,
              "description": "Transmit Control Register"
            },
            "rxctrl": {
              "offset": "0x0C",
              "size": 32,
              "description": "Receive Control Register"
            },
            "ie": {
              "offset": "0x10",
              "size": 32,
              "description": "Interrupt Enable Register"
            },
            "ip": {
              "offset": "0x14",
              "size": 32,
              "description": "Interrupt Pending Register"
            },
            "div": {
              "offset": "0x18",
              "size": 32,
              "description": "Baud Rate Divisor Register"
            }
          }
        }
      },
      "interrupts": {
        "count": 16,
        "vectors": [
          {
            "number": 0,
            "name": "Initial_SP"
          },
          {
            "number": 1,
            "name": "Reset_Handler"
          },
          {
            "number": 2,
            "name": "NMI_Handler"
          },
          {
            "number": 3,
            "name": "HardFault_Handler"
          },
          {
            "number": 4,
            "name": "MemManage_Handler"
          },
          {
            "number": 5,
            "name": "BusFault_Handler"
          },
          {
            "number": 6,
            "name": "UsageFault_Handler"
          },
          {
            "number": 11,
            "name": "SVC_Handler"
          },
          {
            "number": 12,
            "name": "DebugMon_Handler"
          },
          {
            "number": 14,
            "name": "PendSV_Handler"
          },
          {
            "number": 15,
            "name": "SysTick_Handler"
          }
        ]
      }
    }
  }
}